source,source_id,title,abstract,journal,pub_date,doi,url,authors,score,score_reason
PubMed,42178569,Ammonia oxidation and recalcitrant carbon degradation fuel mixotrophic growth in the symbiont community of a deep-sea sponge.,"Sponges are important members of shallow-water, benthic ecosystems, where they often rely on their microbial symbionts to acquire organic or inorganic carbon. Sponges are also found in the deep sea, however, how they metabolically interact there with their symbionts remains underexplored. Here, we combined metagenomic, metatranscriptomic and stable-isotope labelling approaches to investigate the metabolic activities of the microbial community of the deep-sea sponge Calyx sp. Approximately 84% of the total estimated microbial abundance was composed of nine heterotrophic phyla, whilst the remaining 16% consisted of two autotrophic ammonia-oxidising archaea. Metatranscriptomic analysis revealed the high expression of genes involved in the degradation of recalcitrant polysaccharides of algal origin, suggesting that an undegraded fraction of marine snow plays a role in the nutrition of this deep-sea holobiont. Additionally, we detected active ammonia oxidation and carbon fixation pathways in the autotrophic community members and, through ex situ incubations with labelled carbonate show a potential to fix 13.67 mg CO2 per g dry weight in a year. This study highlights the mixotrophic lifestyle of a deep-sea sponge microbiome, expanding our knowledge of the sponge-microbe symbiosis in the oligotrophic environment of the deep ocean. Video Abstract.",Microbiome,2026 May 25,10.1186/s40168-026-02411-y,https://pubmed.ncbi.nlm.nih.gov/42178569/,"Garritano AN, J Hill L, Ribeiro B, Damasceno T, Medeiros L, Duarte G, L S Vilela C, Majzoub ME, et al.",8.5,"keyword+4.0, journal+4.5"
PubMed,42176189,Distribution of a novel DsrEFH sulfur transferase suggests widespread sulfur oxidation capacity in sulfate reducers.,"Microbial sulfur cycling is typically divided into an oxidative and a reductive branch, with microbes driving either sulfide oxidation or sulfate reduction distinguished by their genomic setup. Paradoxically, filamentous cable bacteria perform electrogenic sulfide oxidation but contain genes indicative of sulfate reduction, including the reductive type of dissimilatory sulfite reductase (DsrAB), whereas they apparently lack the canonical sulfur transferase DsrEFH essential for sulfur oxidation. AlphaFold2 structure prediction of conserved cable bacteria proteins with unknown functions identified a protein complex resembling canonical DsrEFH (hereafter termed DsrEFH type II). In vitro characterization of heterologously expressed DsrEFH type II confirmed its sulfur transferase function and, together with site-directed mutagenesis, verified that the conserved cysteine, Cys67, is the active sulfur transfer residue. Genes encoding the novel DsrEFH type II were found in 985 prokaryotic genomes. They typically co-occurred with genes for reductive DsrAB in microbes characterized as sulfate reducers or sulfur disproportionators. This study not only fills an important gap in the sulfide oxidation pathway of cable bacteria, but also suggests that a wide range of sulfate reducing bacteria may be more metabolically versatile than currently understood, representing a major shift in the perception of this globally significant physiological group of microorganisms.",The ISME journal,2026 May 23,10.1093/ismejo/wrag130,https://pubmed.ncbi.nlm.nih.gov/42176189/,"Plum-Jensen LE, Mohr MG, Tanabe TS, Wang B, Echers SG, Madsen NS, Thorup C, Linhartova M, et al.",8.5,"keyword+4.0, journal+4.5"
PubMed,42212790,Moving from a taxonomic to a functional perspective in global microbiome analysis requires optimizing multiplexing ratios.,"Next-generation sequencing has revolutionized microbiome research, yet the transition from taxonomic to functional profiling remains a major technical challenge. While marker gene sequencing provides a widely accessible ecological view, it often lacks the resolution for actionable insights. This perspective argues that shifting to whole metagenomic sequencing is essential for mapping functional potential, such as antimicrobial resistance, and metabolic pathways. However, we identify a critical bottleneck: excessive multiplexing. High multiplexing ratios reduce the number of unique molecules per sample, leading to high duplication rates and the stochastic dropout of low-abundance genes. We demonstrate that functional profiles are far more sensitive to these library complexity issues than taxonomic ones. We recommend prioritizing total sequencing depth and reducing multiplexing to ensure sufficient unique coverage. Additionally, adopting long-read or hybrid architectures is vital for providing the genomic context necessary for strain-level resolution. These optimizations are prerequisites for robust global microbiome synthesis and translational science.",mSystems,2026 May 29,10.1128/msystems.00144-26,https://pubmed.ncbi.nlm.nih.gov/42212790/,"Zielińska K, Pantiukh K, Org E, Łabaj PP, Kosciolek T",8.3,"keyword+4.5, journal+3.8"
PubMed,42208547,Forces Shaping Diversity of Hydrogen Peroxide Detoxification Potential in Ocean Microbial Ecosystems.,"Microbial communities have evolved interactions to support growth and essential ecosystem functions. For example, marine cyanobacteria like Prochlorococcus lack the catalase genes (katE, katG and manganese catalase) required for detoxifying freely-diffusible hydrogen peroxide, relying on co-occurring catalase-carrying 'helper' microbes for this function. However, the eco-evolutionary forces shaping catalase distribution are not well understood. We examined genomes, metagenome-assembled genomes (MAGs), and metagenomes to assess catalase gene distributions across diverse marine prokaryotes-including within the known 'helper' genus Alteromonas-and across surface ocean ecosystems. Within Alteromonas, most genomes contain two katE copies, while katG copy number varies across species. Across ecosystems, the Altermonadaceae family is the predominant katE carrier. Some taxa (e.g., SAR202) lack all catalases, highlighting their dependence on 'helpers'. Overall, streamlined genomes, including from SAR11, generally have one katG copy and lack katE, while larger genomes with higher GC content characteristic of copiotrophs have more copies of both catalases. Finally, in free-living communities, katG gene frequency increases with decreased particulate organic carbon (POC) concentrations, whereas in particle-associated communities, katE gene frequency increases with elevated POC. Together, these observations suggest that hydrogen peroxide detoxification capabilities are widespread and shaped by the contributions of particle-associated microbes to total community metabolism.",Environmental microbiology,2026 Jun,10.1111/1462-2920.70315,https://pubmed.ncbi.nlm.nih.gov/42208547/,"Goldberg H, Dyhrman ST, DeMers MA, Braakman R, Hennon GMM",8.0,"keyword+4.5, journal+3.5"
PubMed,42212640,Prolific S-layer shedding and associated proteins from the methanotroph Methylomicrobium album BG8.,"Some methanotrophs synthesize S-layers that overlay their outer membrane. Transmission electron microscopy imaging revealed that Methylomicrobium album BG8 constitutively sheds abundant S-layer units, a phenotype not found in seven other methanotrophs, even though Methylotuvimicrobium buryatense 5GB1 produces a similar structure. The release of S-layer units occurred regardless of carbon (methane or methanol) or nitrogen (ammonium or nitrate) source, with 50× trace metals, under copper deprivation, and at all growth phases. The released S-layer units were isolated from the culture medium of M. album BG8 by density gradient centrifugation for proteome analysis. The proteome revealed S-layer protein subunits, transporters for calcium uptake, including TolC and repeats-in-toxin (RTX) proteins, transporters for uptake of cobalamin and siderophores, cell wall biogenesis proteins, and proteins with Type I secretion system (T1SS) target domains. M. album BG8 adapted to grow at pH 4 lost its S-layer, and genome analysis revealed a frameshift mutation resulting in reduced expression of the S-layer unit gene, and an in-frame deletion mutation resulting in almost no expression of an S-layer-associated porin gene. Together, the results suggest that the biogenesis and secretion of M. album BG8 S-layer is mediated by its associated T1SS, the S-layer possesses metal acquisition functions, and low pH adaptation of M. album BG8 results in the loss of its S-layer, likely due to reduced or incomplete expression of S-layer units and the loss of an associated porin. The involvement of the T1SS and shedding phenotype of the S-layer in M. album BG8 could be applied toward selective secretion of proteins and other factors of bioindustrial interest. The methanotrophic bacterium Methylomicrobium album BG8 produces and sheds large quantities of S-layer units into the culture medium regardless of carbon or nitrogen source, metal availability, or growth phase. Of the eight methanotrophic bacteria screened, only M. album BG8 possessed this phenotype. Proteomics analysis of density gradient-purified culture supernatant identified the S-layer protein units and proteins involved in metal uptake and S-layer biogenesis, some with secretion signals for the T1SS. M. album BG8 adapted to grow at low pH lost the production of its S-layer due to mutations in the genes encoding S-layer units and an associated porin. Better understanding of M. album BG8 S-layer production and its shedding phenotype could be harnessed for exporting expressed proteins and bioproducts of industrial interest for the ease of collection and downstream processing.",Applied and environmental microbiology,2026 May 29,10.1128/aem.00607-26,https://pubmed.ncbi.nlm.nih.gov/42212640/,"Hermary MK, Rodriguez Gallo MC, Rieberger R, Grigonyte AM, McDonald K, Uhrig RG, Sauvageau D, Stein LY",8.0,"keyword+4.5, journal+3.5"
PubMed,42207417,Engineering Bacillus Subtilis for Efficient Biosynthesis of Riboflavin: Current Knowledge and Future Perspectives.,"Riboflavin is an essential water-soluble vitamin that serves as a precursor for the biosynthesis of the flavin cofactors FMN and FAD, which play pivotal roles in numerous redox and energy metabolism reactions. With the growing global demand for sustainable vitamin production, microbial fermentation has become an attractive alternative to chemical synthesis due to its environmental and economic advantages. Among microbial hosts, Bacillus subtilis has emerged as a leading cell factory for riboflavin production owing to its GRAS status, well-characterized genetics, and efficient protein secretion system. This review provides a comprehensive overview of recent advances in metabolic engineering strategies to enhance riboflavin biosynthesis in B. subtilis. Key topics include strengthening biosynthetic and precursor pathways, relieving feedback inhibition, balancing metabolic flux and cell growth, employing adaptive laboratory evolution, and utilizing omics-guided optimization and 13C metabolic flux analysis. Moreover, the integration of synthetic biology tools such as riboswitch engineering, regulatory element design, and high-throughput screening has significantly accelerated strain improvement. Despite remarkable progress, challenges remain in achieving precise regulatory control, optimizing multi-gene expression, and enhancing genome integration efficiency. Future research combining multi-omics data, synthetic regulatory design, and machine learning-driven predictive modeling is expected to further advance the development of intelligent B. subtilis cell factories. However, the practical implementation of these systems remains constrained by the metabolic burden of overproduction and the lack of universal regulatory models that can predict strain performance across varying industrial scales.",Applied biochemistry and biotechnology,2026 May 28,10.1007/s12010-026-05755-1,https://pubmed.ncbi.nlm.nih.gov/42207417/,"Yu XZ, Liu ZY",8.0,keyword+8.0
PubMed,42206362,Correction to 'Functional convergence in Z-DNA biosynthesis highlighted by the characterization of nucleotide metabolism enzymes in bacteriophages'.,,Nucleic acids research,2026 May 20,10.1093/nar/gkag563,https://pubmed.ncbi.nlm.nih.gov/42206362/,,8.0,"keyword+3.0, journal+5.0"
PubMed,42200295,Bacterial type II topoisomerases cleave DNA in a species-specific manner.,"The type II topoisomerases, gyrase and topoisomerase IV, are ubiquitous enzymes in bacteria that help regulate DNA topology and are the molecular targets of fluoroquinolone antibacterials. As part of their catalytic mechanism, these enzymes transiently cleave DNA in a sequence-dependent manner. Determining the extent to which various factors influence the sequence-dependent cleavage of these enzymes, particularly across bacterial species, could help reveal important insights into their physiological functions and guide the development of new, more effective antibacterials. Here, we used our recently developed SHAN-seq method to map and compare the DNA cleavage site preferences of gyrases and topoisomerase IVs from three different pathogenic bacterial species, Escherichia coli, Bacillus anthracis, and Mycobacterium tuberculosis, in the presence of the fluoroquinolone, ciprofloxacin. We found that the enzymes' cleavage specificities vary across bacterial species, with DNA supercoil chirality, and in response to ciprofloxacin. Our findings suggest that subtle variations in the enzymes' catalytic core and C-terminal domains alter their cleavage site preferences, which could, in turn, influence their physiological activities and susceptibility to fluoroquinolone antibacterials.",Nucleic acids research,2026 May 20,10.1093/nar/gkag527,https://pubmed.ncbi.nlm.nih.gov/42200295/,"Morgan IL, Jian JY, Armenia JF, Osheroff N, Neuman KC",8.0,"keyword+3.0, journal+5.0"
PubMed,42200614,The Hungate1000 prokaryotic culture collection encodes a wide variety of bacteriocins.,"Bacteriocins are antimicrobial peptides/proteins that are widely distributed among bacteria and are gathering traction as natural alternatives to antibiotics, modulators of the microbiota, and interbacterial signaling peptides. The Hungate1000 is a culture collection of isolated prokaryotic microorganisms and their genomes from ruminant animals that aims to expand the knowledge base of rumen ecology. In this study, 410 rumen-isolated prokaryotes within the collection were mined to expand upon the bacteriocin-producing potential of the rumen. A total of 408 novel bacteriocin gene clusters were identified across 308 genomes. Bacteriocins in novel species within the Hungate1000 were identified, such as Pseudobutyrivibrio sp. UC1225, which has two novel natural nisin variants, Clostridium sp. DSM 8431 with a novel peptide 81% identity to amylocyclicin and Lachnobacterium C7 encoding a novel circular bacteriocin with 55% identity to the circular bacteriocin NKR-5-3B. A novel class II lanthipeptide gene cluster was also identified containing eight distinct core peptides encoded within the genome of a novel Butyrivibrio species. Bacteriocin biosynthetic potential was noted within species unknown to produce bacteriocins, such as Lachnobacterium bovis DSM 14045, Lachnospira multipara D15d, Eubacterium callanderi NLAE-zl-G225, Eisenbergiella tayi NLAE-zl-G231, and Muricomes contorta NLAE-zl-C134. The frequency of putative bacteriocin production within ruminal strains was 30%, doubling the frequency previously suggested in the mammalian gastrointestinal tract. This number increases to ~70% when encompassing groups of peptides with limited knowledge of antibacterial activity, such as ranthipeptides and auto-inducing peptides. We also show that the bacteriocin core peptides mined from the Hungate1000 culture collection are found in the microbiomes of other ruminant animals and the human gut microbiome. These findings highlight the Hungate1000 as a rich biosynthetic reservoir of cultured strains that can be experimentally explored for functional antimicrobial activity. The presence of diverse bacteriocin-producing lineages in rumen-associated microbes provides a foundation for future strategies aimed at targeted microbiome modulation, including approaches to improve rumen function and potentially mitigate enteric methane emissions using bacterial strains or their natural products.IMPORTANCEBacteriocins are gathering traction as a possible alternative to antibiotics in some instances. Therefore, it is crucial to discover novel bacteriocins to expand the bacteriocin knowledge base if these peptides are to be translated to the clinic for use in humans or developed as veterinary interventions to modulate rumen function. Here, we use in silico methods to identify the biosynthetic potential of the Hungate1000 culture collection of rumen bacterial strains. We discover 408 novel bacteriocin gene clusters across 308 genomes and identify that the frequency of bacteriocin gene clusters is over 30%, which is double the incidence rate from previous studies of the mammalian gastrointestinal tract. This number increases to approximately 70% when including bacteriocin classes such as ranthipeptides and cyclic-lactone-autoinducer peptides. Together, these findings position the rumen microbiome as a rich and underexplored reservoir of antimicrobial diversity, with potential for the development of targeted microbiome-modulating therapeutics, livestock interventions aimed at improving rumen function, and strategies aligned with One Health goals, including antimicrobial stewardship and methane mitigation.",mSystems,2026 May 27,10.1128/msystems.00195-26,https://pubmed.ncbi.nlm.nih.gov/42200614/,"Hourigan D, Draper L, Leahy SC, Attwood GT, Kelly WJ, Stanton C, Hill C, Ross RP",7.8,"keyword+4.0, journal+3.8"
PubMed,42199008,Increasing plant protein sources in the diet modulates gut microbiota and tryptophan metabolism in men at cardiometabolic risk.,"This study investigated the effect of partially substituting dietary animal with plant protein (PP) sources on the fecal microbiota composition and metabolome in men with increased cardiometabolic risk. In a randomized, controlled, crossover feeding trial (NCT04236518), 19 men with high plasma triglycerides and waist circumference completed two 4-week isoenergetic diets: a flexitarian diet high in PP sources (FLEX, 64% PP) and a more animal-based control diet (CON, 36% PP). Fecal microbiota (shotgun metagenomics: taxa and metabolic pathways) and metabolome (targeted LC-MS) profiles were assessed before and after each diet and integrated with the host plasma metabolome. Delta values (Δd28-d1) were computed (n = 15 participants with all samples available), inter-individual variation was extracted to account for cross-over design, and OPLS-DA analyses comparing FLEX and CON Δd28-d1 were performed. Variables were selected based on their contribution to the diet discrimination effect (VIP > 1.5) and significant differences between groups (p-value < 0.05 from the paired Wilcoxon signed-rank test). The gut microbiota diversity remained unchanged, but FLEX reduced taxa associated with animal-based diets (e.g., Alistipes putredinis). Compared to CON, FLEX increased fecal xanthurenic acid and decreased the genetic potential for indole production. Combined with previously reported plasma changes (increased indole propionic acid and decreased indoxyl sulfate after FLEX), these findings suggest a shift away from indole production toward kynurenine and indole propionic acid-related tryptophan pathways, possibly driven by higher fiber intake, particularly from legumes. A one-month flexitarian diet thus modulated in men specific microbial taxa and metabolism, particularly tryptophan catabolism. These coordinated changes in microbial composition, functional potential, and metabolites indicate that diets higher in PP sources influence gut microbiota activities relevant to cardiometabolic health.",Gut microbes,2026 Dec 31,10.1080/19490976.2026.2677951,https://pubmed.ncbi.nlm.nih.gov/42199008/,"Lépine G, Davila AM, Cueff G, Pickering G, Ichou F, Perreau C, Lefranc-Millot C, Gilles M, et al.",7.5,"keyword+2.5, journal+5.0"
PubMed,42218119,Integration of donor microbiota following FMT correlates with anti-PD-1 response in melanoma.,"Fecal microbiota transplantation (FMT) has shown promise in improving anti-PD-1 therapy in melanoma, but the underlying microbial features remain poorly defined. We performed a strain-resolved metagenomic meta-analysis across three independent FMT plus anti-PD-1 melanoma trials (n = 41). Across cohorts, therapeutic benefit was linked to successful integration of donor microbiota, rather than increased diversity or engraftment of specific species. Responders acquired more donor-derived strains, exhibited greater post-FMT similarity to their donor, and maintained a more stable microbiome. Following FMT, non-responders' microbiomes showed greater taxonomic instability, larger fluctuations in estimated microbial load, and increased abundance of pathogen-associated secretion system genes, whereas responders showed enrichment for microbial functions involved in community-level metabolism and communication. Finally, shifts in tumor-infiltrating immune profiles tracked with clinical outcomes and microbiome changes. Together these findings highlight that distinct patterns of microbiome restructuring, including stable community transitions and altered functional capacity, are associated with anti-PD-1 response following FMT.",Nature communications,2026 May 30,10.1038/s41467-026-73465-7,https://pubmed.ncbi.nlm.nih.gov/42218119/,"Fessler JL, Olm MR, Engleman EG, Sonnenburg JL",7.5,"keyword+2.5, journal+5.0"
PubMed,42207290,Phage-derived proteins and conjugates induce pilus detachment.,"Antimicrobial resistance is a growing global health crisis, with ESKAPE pathogens, such as Acinetobacter species, contributing significantly to hospital-acquired infections. These bacteria employ various virulence factors, including extracellular type IV pili (T4P), which serve as essential appendages for DNA uptake, biofilm formation, and resistance to antibiotics. Single-stranded RNA (ssRNA) bacteriophages (phages) exploit these retractile pili as entry receptors, but the exact mechanism of viral RNA delivery following pilus binding and retraction remains poorly understood. In this study, we investigated the entry mechanism of the ssRNA phage AP205 on its host strain Acinetobacter higginsii. We identified the specific phage components necessary for T4P detachment, a key step in viral genome entry. Our data reveal that the phage's maturation protein (Mat) is sufficient to induce pilus detachment on its own, and the overall virion structure further enhances the efficiency of this process. These findings provide mechanistic insights into how ssRNA phages exploit bacterial T4P as part of their infection pathway and suggest a conserved strategy for host entry. Acinetobacter species are environmental bacteria and members of the ESKAPE pathogens, associated with hospital-acquired infections among immunocompromised patients. Rising antibiotic resistance among Acinetobacter is partly attributed to its use of type IV pili (T4P) to evade treatment. Targeting these virulence factors is a promising strategy to combat these pathogens. Single-stranded RNA bacteriophages naturally interact with T4P, and recent research suggests they can detach pili during infection, but the mechanism remains unclear. Our study identifies components required for this pilus detachment, addressing this knowledge gap. These findings advance understanding of T4P virulence in Acinetobacter species and may guide future approaches to combat antibiotic-resistant infections.",Journal of bacteriology,2026 May 28,10.1128/jb.00604-25,https://pubmed.ncbi.nlm.nih.gov/42207290/,"Frese A, Zhao Z, Zhang J, Zeng L",7.5,keyword+7.5
PubMed,42203770,Dual human milk oligosaccharide-fibre utilisation is a selection cue for the weaning gut microbiome.,"Gut microbiome (GM) maturation in early life follows organised taxonomic successions, yet how the weaning diet impacts these trajectories remains underexplored. Here, we collected faecal samples at pre-, early and late weaning from seven mother-infant dyads forming the Milkome cohort, designed to evaluate the contribution of human milk oligosaccharides (HMOs) to GM maturation during weaning (NCT07026526). Surprisingly, all preweaning infant faecal consortia grew on multiple dietary fibres, consistent with the prevalence of fibre-degradation genes in their metagenomes. Utilisation of both HMOs and dietary fibres was discovered as a metabolic hallmark of the weaning GM, as supported by metagenomics and the growth of faecal consortia on HMOs, following their enrichment on fibres. The growth of a defined consortium on weaning-mimic substrates, further showed that distinct Clostridia simultaneously deploy HMO and fibre utilisation pathways, which confers competitive growth against HMO- or fibre-utilising bifidobacteria. Metagenomics, culturomics and HMO-utilisation profiles of 137 maternal isolates were concordant with retention of the HMO-utilisation capacity by the adult GM. Our findings highlight dual HMO-fibre utilisation as an unrecognised selection cue of core adult GM species during weaning, which outlines a plausible mechanism of GM maturation in early life and extends the importance of HMOs to the weaning transition.",Nature communications,2026 May 27,10.1038/s41467-026-73297-5,https://pubmed.ncbi.nlm.nih.gov/42203770/,"So Y, Pichler MJ, Kappel SS, Jin C, Eriksen C, Chatzigiannidou I, Andersen MHB, Tsiamis V, et al.",7.5,"keyword+2.5, journal+5.0"
